<?xml version="1.0" encoding="UTF-8"?>
<zahtev
    xmlns="http://www.ftn.uns.ac.rs/zahtev"
    xmlns:xsi="http://www.w3.org/2001/XMLSchema-instance"
    xsi:schemaLocation="http://www.ftn.uns.ac.rs/zahtev zahtev.xsd">
    <podaci_o_organu>
        <naziv></naziv>
        <sediste></sediste>
    </podaci_o_organu>
    <sadrzaj_zahteva>
        <naslov>
                        З А Х Т Е В
            за приступ информацији од јавног значаја
        </naslov>
        <paragraf id="p_1" fusnota="У кућици означити која законска права на приступ информацијама желите да остварите">
            На основу <zakon naziv="Закон о слободном приступу информацијама од јавног значаја" clan="15" stav="1"></zakon>
           (<sluzbeni_glasnik>
                <brojevi>
                    <broj br="120/04"></broj>
                    <broj br="57/04"></broj>
                    <broj br="104/09"></broj>
                    <broj br="36/10"></broj>
                </brojevi>
            </sluzbeni_glasnik>), од горе наведеног органа захтевам:
            <stavke>
                <stavka otkaceno = "false" id="s_1" zahtev="обавештење да ли поседује тражену информацију" ></stavka>;
                <stavka otkaceno = "false" id="s_2" zahtev="увид у документ који садржи тражену информацију" ></stavka>;
                <stavka otkaceno = "false" id="s_3" zahtev="копију документа који садржи тражену информацију" ></stavka>;
                <stavka otkaceno = "false" id="s_4" zahtev="достављање копије документа који садржи тражену информацију:" fusnota="У кућици означити начин достављања копије докумената.">
                    <podstavke>
                        <podstavka otkaceno = "false" id="ps_1" nacin="поштом" fusnota=""></podstavka>
                        <podstavka otkaceno = "false" id="ps_2" nacin="електронском поштом" fusnota=""></podstavka>
                        <podstavka otkaceno = "false" id="ps_3" nacin="факсом" fusnota=""></podstavka>
                        <podstavka otkaceno = "false" id="ps_4" nacin="на други начин:" fusnota="Када захтевате други начин достављања обавезно уписати који начин достављања захтевате.">
                            <drugi_nacin> </drugi_nacin>
                        </podstavka>
                    </podstavke>
                </stavka>
            </stavke>
            Овај захтев се односи на следеће информације:
            <opis_trazene_informacije></opis_trazene_informacije>
        </paragraf>
    </sadrzaj_zahteva>
    <podnozje>
        <mesto_i_datum>
            <mesto></mesto>
            <datum>2020-12-04</datum> 
        </mesto_i_datum>
        <informacije_o_traziocu>
            <ime_i_prezime> </ime_i_prezime>
            <adresa> 
                <ulica></ulica>
                <broj></broj>
                <mesto></mesto>
            </adresa>
            <kontakt> </kontakt>
            <potpis> </potpis>
        </informacije_o_traziocu>
    </podnozje>
</zahtev>
